{
    "nombreVideojuego": "The Legend of Zelda: Breath of the Wild",
    "lanzamiento": 2017,
    "generos": ["Aventura", "Acci√≥n", "Mundo abierto"],
    "plataformas": ["Nintendo Switch", "Wii U"],
    "clasificacionESRB": "E10+ (Everyone 10+)",
    "desarrollador": "Nintendo",
    "duracionEstimada": "50 horas",
    "multijugador": false
}

